{
  "schema_version": "1.0",
  "evidence_id": "fixture-standard-hot-composed-api-v1",
  "evidence_kind": "test_fixture",
  "candidate_eligible": false,
  "source": {
    "revision": "a799f2e3d166eab4489e7451a5b53f59a9d78f50",
    "dirty": false,
    "recorded_at": "2026-08-30T14:14:27Z",
    "tool_versions": {
      "go": "1.27.0",
      "node": "26.8.1",
      "ruby": "3.4.10"
    }
  },
  "scenario": {
    "id": "fixture-hot-composed-metadata",
    "type": "hot_composed_metadata_api",
    "benchmark_profile": "standard",
    "disclosure_mode": "request_boundary",
    "dataset_version": "stead-standard-request-boundary-v1",
    "device": "synthetic-contract-device",
    "network": "synthetic-colocated-network",
    "topology": "synthetic-colocated-reference-topology",
    "corpus": "synthetic-authorized-general-project",
    "load_shape": "single-user-hot",
    "state": "warm",
    "sample_count": 100,
    "ordinary_read": true,
    "primary_surface_after_shell": true,
    "set_oriented": true,
    "frontend_touched": true
  },
  "counts": {
    "browser_requests": 1,
    "sql_queries": 4,
    "postgres_writes": 1,
    "openfga_calls": 1,
    "policy_calls": 1,
    "provider_calls": 0,
    "nats_waits": 0,
    "logical_audit_operations": 1,
    "browser_forbidden_origin_requests": 0,
    "authorization_cache_hits": 0
  },
  "timings_ms": {
    "latency": { "p50": 20.0, "p95": 80.0, "p99": 95.0 },
    "sql": { "p50": 3.0, "p95": 9.0, "p99": 12.0 },
    "openfga": { "p50": 1.0, "p95": 3.0, "p99": 5.0 },
    "policy": { "p50": 0.5, "p95": 1.5, "p99": 2.0 },
    "provider": { "p50": 0.0, "p95": 0.0, "p99": 0.0 },
    "projection_lag": { "p50": 200.0, "p95": 800.0, "p99": 950.0 }
  },
  "sizes": {
    "response_bytes": 48000,
    "eager_javascript_gzip_bytes": 60808,
    "lazy_javascript_chunks": [],
    "frontend_baseline": {
      "baseline_id": "foundation-shell-a799f2e",
      "baseline_gzip_bytes": 60808,
      "current_gzip_bytes": 60808,
      "delta_gzip_bytes": 0,
      "lazy_chunk_delta_gzip_bytes": 0
    }
  },
  "web_vitals": {
    "lcp_ms": 400.0,
    "inp_ms": 30.0,
    "cls": 0.01
  },
  "count_budgets": {
    "sql_queries": 4,
    "postgres_writes": 1,
    "openfga_calls": 1,
    "policy_calls": 1,
    "provider_calls": 0,
    "logical_audit_operations": 1
  },
  "scaling_trials": [
    { "result_count": 1, "sql_queries": 4, "postgres_writes": 1, "openfga_calls": 1, "policy_calls": 1, "provider_calls": 0, "logical_audit_operations": 1 },
    { "result_count": 25, "sql_queries": 4, "postgres_writes": 1, "openfga_calls": 1, "policy_calls": 1, "provider_calls": 0, "logical_audit_operations": 1 },
    { "result_count": 100, "sql_queries": 4, "postgres_writes": 1, "openfga_calls": 1, "policy_calls": 1, "provider_calls": 0, "logical_audit_operations": 1 },
    { "result_count": 250, "sql_queries": 4, "postgres_writes": 1, "openfga_calls": 1, "policy_calls": 1, "provider_calls": 0, "logical_audit_operations": 1 }
  ],
  "baseline_comparison": [
    {
      "metric": "timings_ms.latency.p95",
      "baseline": 75.0,
      "current": 80.0,
      "regression_percent": 6.6667,
      "critical": true,
      "independent_review_ref": null
    },
    {
      "metric": "sizes.eager_javascript_gzip_bytes",
      "baseline": 60808,
      "current": 60808,
      "regression_percent": 0.0,
      "critical": true,
      "independent_review_ref": null
    }
  ],
  "telemetry": {
    "safe_correlation_id": "perf-fixture-0001",
    "protected_content_canary_hits": 0
  }
}
